{
  "schema_version": "1.1.0",
  "id": "DEC-20260812-9D73F687",
  "kind": "decision",
  "project_id": "ahp-plus",
  "title": "Emancipar AHP+ como protocolo independiente por repositorio",
  "description": "AHP+ se separa de Pangea OS como protocolo y CLI instalable, conservando Git como fuente de verdad y Pangea como consumidor.",
  "status": "ACCEPTED",
  "confidence": "USER_CONFIRMED",
  "created_at": "2026-08-12T23:10:48.935Z",
  "updated_at": "2026-08-12T23:10:48.935Z",
  "actor": {
    "name": "Jossue Alcalá",
    "platform": "human",
    "model": "n-a"
  },
  "source_refs": [
    "user:2026-08-12-hagamoslo-con-precision"
  ],
  "base_commit": null,
  "tags": [
    "emancipation",
    "protocol",
    "governance"
  ]
}
