{
  "schema_version": "1.1.0",
  "id": "QA-20260812-2906F954",
  "kind": "qa",
  "project_id": "ahp-plus",
  "title": "Windows Git root normalization gate",
  "description": "Repository identity is normalized from git rev-parse into a native absolute path.",
  "status": "PASS",
  "confidence": "VERIFIED",
  "created_at": "2026-08-12T23:27:36.833Z",
  "updated_at": "2026-08-12T23:27:36.833Z",
  "actor": {
    "name": "Codex",
    "platform": "codex",
    "model": "GPT-5"
  },
  "source_refs": [
    "EVD-20260812-43499C08",
    "EVD-20260812-49107838"
  ],
  "base_commit": "fd668c8211edf09f5c0f2abaa6294d102bef85c0",
  "tags": []
}
