{
  "schema_version": "1.1.0",
  "id": "DEC-20260813-7D51BE5F",
  "kind": "decision",
  "project_id": "ahp-plus",
  "title": "Condicionar v1.1.0 estable a documentación y piloto de usuarios",
  "description": "Antes de liberar AHP+ estable se documentarán instalación, gestión, uso y posicionamiento; dos usuarios interesados podrán participar en el piloto de mejora; la publicación requerirá revisión y autorización posterior del propietario.",
  "status": "ACCEPTED",
  "confidence": "USER_CONFIRMED",
  "created_at": "2026-08-13T00:26:48.403Z",
  "updated_at": "2026-08-13T00:26:48.403Z",
  "actor": {
    "name": "Jossue Alcalá",
    "platform": "human",
    "model": "n/a"
  },
  "source_refs": [
    "user:2026-08-12-prelaunch-documentation-and-pilot"
  ],
  "base_commit": "6dfffd7814bc1a15533b40e8bbbab6e77eb76407",
  "tags": [
    "stable-release",
    "documentation",
    "pilot",
    "authority"
  ]
}
