{
  "schema_version": "1.1.0",
  "id": "DEC-20260812-3F8CD0C9",
  "kind": "decision",
  "project_id": "ahp-plus",
  "title": "Publicar AHP+ bajo Apache-2.0",
  "description": "El propietario aprobó Apache-2.0, el repositorio jossuealcacao-exe/ahp_plus, el paquete @jossuealcala/ahp-plus y el flujo de commit, push, tag y publicación GitHub.",
  "status": "ACCEPTED",
  "confidence": "USER_CONFIRMED",
  "created_at": "2026-08-12T23:17:39.302Z",
  "updated_at": "2026-08-12T23:17:39.302Z",
  "actor": {
    "name": "Jossue Alcalá",
    "platform": "human",
    "model": "n-a"
  },
  "source_refs": [
    "user:2026-08-12-perfecto-hagamoslo"
  ],
  "base_commit": null,
  "tags": [
    "license",
    "apache-2.0",
    "release",
    "github"
  ]
}
