{
  "schema_version": "1.1.0",
  "id": "QA-20260813-33B694BC",
  "kind": "qa",
  "project_id": "ahp-plus",
  "title": "AHP+ 1.1.0 stable release candidate gate",
  "description": "The stable package, public documentation, distribution channels, adapter commands, local conformance, independent tarball consumer, and real Iris interplatform handoff are verified. Remote CI and publication acceptance remain post-commit gates.",
  "status": "PASS",
  "confidence": "VERIFIED",
  "created_at": "2026-08-13T00:39:50.760Z",
  "updated_at": "2026-08-13T00:39:50.760Z",
  "actor": {
    "name": "Codex",
    "platform": "codex",
    "model": "GPT-5"
  },
  "source_refs": [
    "EVD-20260813-8BE86898",
    "EVD-20260813-7ADB1D26",
    "EVD-20260813-A080C9F5"
  ],
  "base_commit": "6dfffd7814bc1a15533b40e8bbbab6e77eb76407",
  "tags": [
    "stable-release",
    "release-candidate"
  ]
}
