{
  "schema_version": "1.1.0",
  "id": "QA-20260812-A8BCAAFD",
  "kind": "qa",
  "project_id": "ahp-plus",
  "title": "AHP+ public GitHub release acceptance",
  "description": "Repository, annotated tag, GitHub prerelease, and installation from the public tag were verified.",
  "status": "PASS",
  "confidence": "VERIFIED",
  "created_at": "2026-08-12T23:20:31.161Z",
  "updated_at": "2026-08-12T23:20:31.161Z",
  "actor": {
    "name": "Codex",
    "platform": "codex",
    "model": "GPT-5"
  },
  "source_refs": [
    "EVD-20260812-24693F72",
    "EVD-20260812-BE1BA620"
  ],
  "base_commit": "b00b25cb06a802c7b347a0effbb9c97134760442",
  "tags": [
    "public-release",
    "github",
    "tag-install"
  ]
}
